id,published,title,source,content,question1,question2,question3,question4,question5,answer1,answer2,answer3,answer4,answer5
1,"28/05/2024","UKT Tahun Ini Batal Naik, Bagaimana Mahasiswa yang Telanjur Bayar?","Kompas.com","#KOMPAS.com - *Kementerian Pendidikan, Kebudayaan, Riset, dan Teknologi (Kemendikbud Ristek) membatalkan kenaikan uang kuliah tunggal (UKT) tahun ajaran 2024/2025. Kenaikan UKT dibatalkan setelah Mendikbud Ristek, Nadiem Anwar Makarim berdiskusi dengan para rektor di Perguruan Tinggi Negeri (PTN) dan bertemu dengan Presiden Joko Widodo di Istana Presiden, Jakarta, Senin (27/5/2024). 'Baru saja saya bertemu dengan Bapak Presiden dan beliau menyetujui pembatalan kenaikan UKT,' kata dia, dikutip dari keterangan resmi yang diterima Kompas.com, Senin. Ia memastikan tahun ini tidak ada mahasiswa yang terdampak kenaikan UKT akibat implementasi Permendikbudristek Nomor 2 Tahun 2024 tentang Standar Satuan Biaya Operasional Pendidikan Tinggi (SSBOPT) menimbulkan polemik. Sebelumnya, sejumlah PTN menetapkan kenaikan UKT. Nominalnya terbilang cukup besar dan dinilai tidak wajar. Misalnya kenaikan dari UKT golongan empat ke golongan lima dan seterusnya dengan rata-rata mencapai lima sampai 10 persen. Lantas, bagaimana dengan mahasiswa yang sudah telanjur membayar UKT sesuai aturan terbaru?/n/n#Penjelasan Kemendikbud Ristek*Setelah kenaikan UKT dibatalkan, Nadiem mengatakan, dalam waktu dekat pihaknya akan segera mereevaluasi ajuan UKT dari seluruh PTN di Indonesia. Ia mengimbau kepada PTN untuk melakukan jemput bola kepada calon mahasiswa baru yang terlanjur mengundurkan diri karena terbebani UKT. 'Saya berharap, calon mahasiswa baru agar diberitahukan mengenai kebijakan terakhir pembatalan kenaikan UKT. Jika tidak jadi mengundurkan diri, perlu diterima kembali,' kata Nadiem, dikutip dari keterangan resmi yang diterima Kompas.com, Senin. Ia juga mengimbau kepada PTN untuk mengembalikan kelebihan UKT yang terlanjur dibayarkan mahasiswa baru. 'Bagi mahasiswa yang sudah membayar dengan UKT yang dinaikkan, maka perlu ditindaklanjuti oleh PTN agar kelebihan pembayaran dikembalikan atau diperhitungkan pada semester selanjutnya,' terang Nadiem./n/n#Alasan kenaikan UKT dibatalkan*Diberitakan Kompas.com, Senin, Nadiem mengaku merasa cemas saat melihat besaran kenaikan UKT akibat implementasi Permendikbudristek Nomor 2 Tahun 2024. Ia juga banyak mendengar aspirasi dari mahasiswa, keluarga, dan masyarakat yang turut mempersoalkan kenaikan UKT tahun ini yang dinilai memberatkan. 'Memang itu saya melihat beberapa angka-angkanya dan itu juga membuat saya pu cukup mencemaskan,' kata dia. Oleh karena itu, pada pekan lalu, Nadiem bertemu dan berdiskusi dengan para petinggi PTN guna membahas pembatalan UKT. Berdasarkan aspirasi yang dihimpun, Nadiem akhirnya memutuskan untuk membatalkan kenaikan UKT tahun ini. Nadiem mengaku mengajukan beberapa pendekatan untuk mengatasi kesulitan yang dihadapi mahasiswa, termasuk soal UKT.","Kementerian Pendidikan, Kebudayaan, Riset, dan Teknologi (Kemendikbud Ristek) membatalkan kenaikan uang kuliah tunggal (UKT) tahun ajaran 2024/2025 setelah berdiskusi dengan rektor dan bertemu dengan Presiden Joko Widodo.","Nadiem Anwar Makarim memastikan bahwa pada tahun ini tidak ada mahasiswa yang terdampak kenaikan UKT akibat implementasi Permendikbudristek Nomor 2 Tahun 2024.","Kenaikan UKT yang ditetapkan oleh sejumlah PTN sebelumnya adalah rata-rata mencapai lima sampai 10 persen untuk semua golongan.","Nadiem mengimbau kepada PTN untuk tidak menerima kembali calon mahasiswa baru yang sudah mengundurkan diri karena terbebani UKT.","Salah satu alasan Nadiem membatalkan kenaikan UKT adalah karena ia merasa cemas dengan besaran kenaikan UKT dan mendengar aspirasi dari mahasiswa, keluarga, dan masyarakat.","true","true","false","false","true"
2,"29/05/2024","Harga BBM Naik, Apa Saja Dampaknya?","Detik.com","Harga BBM di Indonesia mengalami kenaikan sebesar 10% mulai bulan depan. Pemerintah menyatakan kenaikan ini sebagai bagian dari penyesuaian harga minyak dunia yang terus meningkat. Menurut Menteri Energi dan Sumber Daya Mineral, kenaikan ini diharapkan dapat menekan defisit anggaran dan mendukung pembangunan infrastruktur. 'Kami paham bahwa kenaikan ini akan berdampak pada masyarakat, namun kami juga akan memberikan subsidi bagi mereka yang membutuhkan,' ujar Menteri. Kenaikan harga BBM ini juga diprediksi akan berdampak pada kenaikan harga barang dan jasa lainnya, termasuk transportasi dan bahan pokok. Pengamat ekonomi menyarankan pemerintah untuk memperhatikan dampak jangka panjang dari kenaikan ini terhadap daya beli masyarakat.","Harga BBM di Indonesia naik sebesar 10% mulai bulan depan.","Kenaikan harga BBM ini diumumkan oleh Menteri Energi dan Sumber Daya Mineral.","Kenaikan harga ini tidak mempengaruhi harga barang lain di pasar.","Pemerintah akan memberikan bantuan kepada masyarakat yang terdampak kenaikan harga BBM.","Harga minyak dunia adalah faktor utama kenaikan harga BBM di Indonesia.","true","true","false","true","true"
3,"30/05/2024","Pembangunan Jalan Tol Baru di Sumatera","TribunNews","Pemerintah akan membangun jalan tol baru sepanjang 150 km di Sumatera yang diharapkan dapat mengurangi kemacetan dan meningkatkan ekonomi wilayah tersebut. Proyek ini merupakan bagian dari program infrastruktur nasional yang dicanangkan oleh Presiden. 'Jalan tol ini akan menghubungkan beberapa kota besar di Sumatera dan mempercepat arus logistik,' kata Menteri Pekerjaan Umum dan Perumahan Rakyat. Proyek ini akan didanai melalui anggaran negara dan pinjaman dari lembaga internasional. Pembangunan ini juga diharapkan dapat membuka lapangan pekerjaan baru bagi masyarakat sekitar.","Jalan tol baru di Sumatera akan memiliki panjang 150 km.","Pembangunan jalan tol ini akan selesai dalam waktu dua tahun.","Proyek ini didanai sepenuhnya oleh swasta tanpa campur tangan pemerintah.","Jalan tol ini diharapkan dapat mengurangi kemacetan di wilayah Sumatera.","Peningkatan ekonomi wilayah adalah salah satu tujuan pembangunan jalan tol ini.","true","true","false","true","true"
4,"01/06/2024","Festival Film Internasional di Jakarta","JakartaPost","Festival Film Internasional akan diadakan di Jakarta bulan depan, menampilkan berbagai film dari seluruh dunia. Acara ini juga akan menghadirkan sutradara terkenal untuk diskusi dan workshop. Festival ini merupakan ajang tahunan yang sudah dinanti-nanti oleh para pecinta film. 'Kami sangat antusias dengan festival tahun ini karena akan ada lebih banyak film dan pembicara terkenal yang hadir,' kata Ketua Panitia. Tiket untuk acara ini sudah mulai dijual secara online dan offline, dengan harga yang terjangkau untuk semua kalangan. Pemerintah DKI Jakarta juga memberikan dukungan penuh untuk kesuksesan acara ini.","Festival Film Internasional akan diadakan di Jakarta bulan depan.","Acara ini hanya menampilkan film-film dari Asia Tenggara.","Sutradara terkenal akan hadir dalam festival ini untuk diskusi dan workshop.","Festival ini diadakan setiap tahun di Jakarta.","Tiket masuk festival ini gratis untuk umum.","true","false","true","true","false"
5,"02/06/2024","Inovasi Teknologi di Bidang Kesehatan","Tempo","Berbagai inovasi teknologi di bidang kesehatan telah diperkenalkan tahun ini, termasuk perangkat medis canggih dan aplikasi kesehatan berbasis AI. Perangkat medis terbaru dapat membantu diagnosis lebih cepat dan akurat, sementara aplikasi kesehatan berbasis AI membantu memantau kondisi pasien secara real-time. 'Inovasi ini sangat penting untuk meningkatkan kualitas pelayanan kesehatan dan efisiensi rumah sakit,' kata Direktur Rumah Sakit ABC. Selain itu, teknologi ini juga membantu dalam penelitian medis dan pengembangan obat baru. Beberapa rumah sakit di Indonesia sudah mulai mengadopsi teknologi ini dengan hasil yang positif.","Inovasi teknologi kesehatan tahun ini mencakup perangkat medis canggih.","Aplikasi kesehatan berbasis AI tidak termasuk dalam inovasi tahun ini.","Teknologi baru ini diharapkan dapat meningkatkan pelayanan kesehatan.","Perangkat medis canggih hanya digunakan di rumah sakit besar.","AI digunakan untuk membantu diagnosis penyakit.","true","false","true","false","true"
6,"03/06/2024","Pengembangan Energi Terbarukan di Indonesia","Kompas","Indonesia terus mengembangkan proyek energi terbarukan untuk mengurangi ketergantungan pada bahan bakar fosil dan mengatasi perubahan iklim. Proyek terbaru termasuk pembangunan pembangkit listrik tenaga surya dan angin. 'Pengembangan energi terbarukan adalah kunci untuk mencapai target emisi karbon netral pada tahun 2060,' kata Menteri Energi dan Sumber Daya Mineral. Pemerintah juga memberikan insentif bagi perusahaan swasta yang berinvestasi di sektor energi terbarukan. Proyek ini diharapkan dapat meningkatkan kapasitas energi terbarukan di Indonesia dan menciptakan lapangan pekerjaan baru.","Indonesia mengembangkan proyek energi terbarukan untuk mengurangi ketergantungan pada bahan bakar fosil.","Pemerintah memberikan insentif bagi perusahaan swasta yang berinvestasi di sektor energi terbarukan.","Proyek ini tidak termasuk dalam upaya mengatasi perubahan iklim.","Pembangunan pembangkit listrik tenaga surya dan angin adalah bagian dari proyek ini.","Target emisi karbon netral akan dicapai pada tahun 2030.","true","true","false","true","false"
7,"04/06/2024","Pembangunan Bandara Baru di Jawa Timur","Detik.com","Pemerintah akan membangun bandara baru di Jawa Timur untuk meningkatkan konektivitas wilayah tersebut. Bandara ini akan memiliki landasan pacu yang lebih panjang dan fasilitas yang lebih modern. 'Bandara ini akan menjadi salah satu bandara terbesar di Indonesia dan akan melayani penerbangan internasional,' kata Menteri Perhubungan. Proyek ini juga diharapkan dapat meningkatkan pariwisata di Jawa Timur dan mendukung pertumbuhan ekonomi wilayah tersebut. Bandara ini akan didanai melalui anggaran negara dan kerjasama dengan investor swasta.","Pemerintah akan membangun bandara baru di Jawa Timur.","Bandara ini akan memiliki fasilitas yang lebih modern daripada bandara lama.","Bandara ini hanya akan melayani penerbangan domestik.","Proyek ini tidak termasuk dalam upaya meningkatkan pariwisata di Jawa Timur.","Bandara ini akan didanai sepenuhnya oleh anggaran negara.","true","true","false","false","false"
8,"05/06/2024","Pembangunan Kereta Cepat Jakarta-Surabaya","TribunNews","Pemerintah akan membangun kereta cepat yang menghubungkan Jakarta dan Surabaya untuk mempercepat arus transportasi antar kota. Proyek ini akan memiliki kecepatan maksimum 300 km/jam dan waktu tempuh sekitar 5 jam. 'Kereta cepat ini akan menjadi sarana transportasi yang efisien dan nyaman bagi masyarakat,' kata Menteri Perhubungan. Proyek ini juga diharapkan dapat mengurangi kemacetan di jalur darat dan udara antara kedua kota. Kereta cepat ini akan didanai melalui anggaran negara dan kerjasama dengan investor swasta.","Pemerintah akan membangun kereta cepat yang menghubungkan Jakarta dan Surabaya.","Kereta cepat ini akan memiliki kecepatan maksimum 200 km/jam.","Waktu tempuh dari Jakarta ke Surabaya dengan kereta cepat sekitar 5 jam.","Proyek ini tidak termasuk dalam upaya mengurangi kemacetan di jalur darat dan udara.","Kereta cepat ini akan didanai sepenuhnya oleh anggaran negara.","true","false","true","false","false"
9,"06/06/2024","Pembangunan Pelabuhan Baru di Kalimantan","JakartaPost","Pemerintah akan membangun pelabuhan baru di Kalimantan untuk meningkatkan konektivitas wilayah tersebut. Pelabuhan ini akan memiliki fasilitas yang lebih modern dan kapasitas yang lebih besar. 'Pelabuhan ini akan menjadi salah satu pelabuhan terbesar di Indonesia dan akan melayani pelayaran internasional,' kata Menteri Perhubungan. Proyek ini juga diharapkan dapat meningkatkan ekspor dan impor di Kalimantan serta mendukung pertumbuhan ekonomi wilayah tersebut. Pelabuhan ini akan didanai melalui anggaran negara dan kerjasama dengan investor swasta.","Pemerintah akan membangun pelabuhan baru di Kalimantan.","Pelabuhan ini akan memiliki fasilitas yang lebih modern daripada pelabuhan lama.","Pelabuhan ini hanya akan melayani pelayaran domestik.","Proyek ini tidak termasuk dalam upaya meningkatkan ekspor dan impor di Kalimantan.","Pelabuhan ini akan didanai sepenuhnya oleh anggaran negara.","true","true","false","false","false"
10,"07/06/2024","Pembangunan Jembatan Baru di Bali","Tempo","Pemerintah akan membangun jembatan baru di Bali untuk menghubungkan dua wilayah yang terpisah oleh sungai. Jembatan ini akan memiliki panjang 500 meter dan lebar 20 meter. 'Jembatan ini akan menjadi salah satu jembatan terpanjang di Indonesia dan akan menjadi ikon pariwisata di Bali,' kata Menteri Pekerjaan Umum dan Perumahan Rakyat. Proyek ini juga diharapkan dapat meningkatkan konektivitas antar wilayah di Bali dan mendukung pertumbuhan ekonomi wilayah tersebut. Jembatan ini akan didanai melalui anggaran negara dan kerjasama dengan investor swasta.","Pemerintah akan membangun jembatan baru di Bali.","Jembatan ini akan memiliki panjang 500 meter dan lebar 10 meter.","Jembatan ini akan menjadi ikon pariwisata di Bali.","Proyek ini tidak termasuk dalam upaya meningkatkan konektivitas antar wilayah di Bali.","Jembatan ini akan didanai sepenuhnya oleh anggaran negara.","true","false","true","false","false"